{
  "$schema": "https://json-schema.org/draft/2020-12/schema",
  "title": "Quickwheel Configuration",
  "type": "object",
  "properties": {
    "schemaVersion": { "type": "integer", "enum": [1, 2] },
    "name": { "type": "string" },
    "mode": { "type": "string", "enum": ["replace", "merge"] },
    "settings": { "$ref": "#/$defs/settings" },
    "slots": { "$ref": "#/$defs/slots" },
    "layers": {
      "type": "array",
      "items": { "$ref": "#/$defs/layer" },
      "maxItems": 9
    }
  },
  "$defs": {
    "slots": {
      "type": "object",
      "properties": {
        "up": { "$ref": "#/$defs/slot" },
        "down": { "$ref": "#/$defs/slot" },
        "left": { "$ref": "#/$defs/slot" },
        "right": { "$ref": "#/$defs/slot" }
      },
      "additionalProperties": false
    },
    "layer": {
      "type": "object",
      "properties": {
        "id": { "type": "string" },
        "name": { "type": "string" },
        "up": { "$ref": "#/$defs/slot" },
        "down": { "$ref": "#/$defs/slot" },
        "left": { "$ref": "#/$defs/slot" },
        "right": { "$ref": "#/$defs/slot" }
      },
      "additionalProperties": false
    },
    "slot": {
      "oneOf": [
        { "$ref": "#/$defs/action" },
        {
          "type": "object",
          "properties": {
            "id": { "type": "string" },
            "steps": {
              "type": "array",
              "items": { "$ref": "#/$defs/action" },
              "minItems": 1
            }
          },
          "required": ["steps"],
          "additionalProperties": false
        }
      ]
    },
    "settings": {
      "type": "object",
      "properties": {
        "isEnabled": { "type": "boolean" },
        "triggerModifier": {
          "type": "string",
          "enum": ["leftCommand", "rightCommand", "eitherCommand", "leftOption", "rightOption", "eitherOption", "leftControl", "rightControl", "eitherControl", "leftShift", "rightShift", "eitherShift"]
        },
        "menuBarSymbolName": { "type": "string" },
        "centerSymbolName": { "type": "string" },
        "deadZoneRadius": { "type": "number", "minimum": 12, "maximum": 120 },
        "overlaySize": { "type": "number", "minimum": 144, "maximum": 260 },
        "showOverlayLabels": { "type": "boolean", "default": false },
        "layers": {
          "type": "array",
          "items": { "$ref": "#/$defs/layer" },
          "maxItems": 9
        },
        "up": { "$ref": "#/$defs/action" },
        "down": { "$ref": "#/$defs/action" },
        "left": { "$ref": "#/$defs/action" },
        "right": { "$ref": "#/$defs/action" }
      },
      "additionalProperties": false
    },
    "action": {
      "type": "object",
      "properties": {
        "id": { "type": "string" },
        "title": { "type": "string" },
        "iconName": { "type": "string" },
        "iconImagePath": { "type": "string", "description": "Custom icon image. Relative paths resolve against the Quickwheel configuration folder." },
        "kind": {
          "type": "string",
          "enum": ["none", "openURL", "openFile", "revealInFinder", "launchApp", "shellCommand", "appleScript", "pasteText", "keyboardShortcut"]
        },
        "urlString": { "type": "string" },
        "filePath": { "type": "string" },
        "bundleIdentifier": { "type": "string" },
        "shellCommand": { "type": "string" },
        "appleScript": { "type": "string" },
        "text": { "type": "string" },
        "shortcutKey": { "type": "string" },
        "shortcutKeyCode": { "type": "integer" },
        "shortcutModifiers": { "type": "integer" }
      },
      "required": ["kind"],
      "additionalProperties": false
    }
  }
}
